FileName,ResearchQuestion,Theme,Subject,Sentence,DominantTopic,TopicKeywords
A29,RQ1,Impact and Applicability,Develop tools and techniques,A number of systems have emerged specifically to facilitate dynamic synchronization of data between different types of computing devices.,0,"systems, data, security, system, privacy, users, development, computing"
A29,RQ3,Relationship with SWeBok,Software architecture,Liquid software entails a virtualized but personal computing experience that is independent of any particular device or OS platform.,1,"software, part, astronomical, engineering, integral, quality, come, projects"
A29,RQ3,Relationship with SWeBok,Software Security,The very mobility of liquid software is a curse because it can open potentially huge security holes.,1,"software, part, astronomical, engineering, integral, quality, come, projects"
A30,RQ1,Principles and Values,Innovation,Deliver continuously innovative and operationally relevant capabilities to meet our stakeholder needs.,4,"process, mining, data, business, provides, bridge, modeling, important"
A30,RQ1,Principles and Values,Change,Change is constant - Build and maintain a foundation of trust across the enterprise.,4,"process, mining, data, business, provides, bridge, modeling, important"
A30,RQ1,Objective and Motivation,Transforming current practices through innovations,Enterprise Agility is based on best practices and integration of established frameworks and standards outside the development domain.,0,"systems, data, security, system, privacy, users, development, computing"
A30,RQ1,Objective and Motivation,Changing culture and practices,Organizational change is required for the enterprise to move at DevOps speed of technical change.,4,"process, mining, data, business, provides, bridge, modeling, important"
A30,RQ1,Main Guidelines,Address ethical and social issues,Integrity of capabilities through continuous integration of risk & opportunity driven innovative change.,4,"process, mining, data, business, provides, bridge, modeling, important"
A30,RQ1,Impact and Applicability,Develop tools and techniques,Exploit business and engineering opportunities to maintain operational excellence and enhance operational agility.,4,"process, mining, data, business, provides, bridge, modeling, important"
A30,RQ3,Relationship with SWeBok,Software Quality,Operational excellence in the Industry 4.0 age requires an enterprise architecture that not only embraces risk & opportunity it must embrace cyber-physical dependencies as well.,3,"design, principles, community, people, need, thinking, must, patterns"
A31,RQ1,Principles and Values,Openness,The introduction of increased functionality at the edge opens up opportunities to execute network functions and applications closer to the customer increasing his quality of experience.,1,"software, part, astronomical, engineering, integral, quality, come, projects"
A31,RQ1,Objective and Motivation,Responding to emerging challenges and opportunities,This paper argues that future network infrastructures will be composed by a stateless and low-complexity Core Network interconnecting very dynamic Edge Networks (ENs) capable of executing – in orchestration with Data Centers (DCs) - all the stateful network functions and services.,0,"systems, data, security, system, privacy, users, development, computing"
A31,RQ1,Call to Action,Creating a better future,Future steps in this direction include modeling and simulating diverse cooperation-competition business strategies for Telco-ICT ecosystems at the edge.,4,"process, mining, data, business, provides, bridge, modeling, important"
A31,RQ2,Gaps,Lack of practical guidelines for implementing principles,Efficient methods are required to create optimal paths and Edge ICT Fabric-resource allocations under continuously changing conditions.,0,"systems, data, security, system, privacy, users, development, computing"
A31,RQ2,Gaps,Lack of evaluation and monitoring of the impact of manifestos,The paper has described three use cases whose study has allowed the derivation of a number of high-level requirements.,3,"design, principles, community, people, need, thinking, must, patterns"
A31,RQ3,Relationship with SWeBok,Software architecture,Future network infrastructures will be composed by a stateless and low-complexity Core Network interconnecting very dynamic Edge Networks capable of executing network functions and services.,0,"systems, data, security, system, privacy, users, development, computing"
A32,RQ1,Principles and Values,Openness,These pillars aim to unleash a cost-effective and high-quality ecosystem that fosters the usage of certification in the real-world.,1,"software, part, astronomical, engineering, integral, quality, come, projects"
A32,RQ1,Objective and Motivation,Transforming current practices through innovations,Our roadmap defines 6 research directions that aim to address the challenges in Section III.,2,"research, open, work, future, extent, basic, also, community"
A33,RQ1,Principles and Values,Innovation,Provisioning of highly adaptable and scalable microservices would be key to timely meeting ever-changing human desires and ever-evolving system requirements in the nimblest manner.,0,"systems, data, security, system, privacy, users, development, computing"
A33,RQ1,Objective and Motivation,Transforming current practices through innovations,An ultra-agile and field-programmable development methodology and environment will be imperative to achieving such ultra-fine grained microservices provisioning.,0,"systems, data, security, system, privacy, users, development, computing"
A33,RQ2,Gaps,Lack of evaluation and monitoring of the impact of manifestos,A still open issue is to simultaneously consider different models and coordinate the different independent reasoning processes by an explicit representation of the different uncertainties present in a system.,0,"systems, data, security, system, privacy, users, development, computing"
A33,RQ2,Gaps,Little attention to the evolution and adaptation of manifestos,Much remains missing in achieving an explicit microservices architecture specifically suitable for IoT.,0,"systems, data, security, system, privacy, users, development, computing"
A34,RQ1,Principles and Values,Collaboration,Services computing professionals and software engineers have been finding ways to intersect theories and practices that used to be more of a concern for the other camp.,1,"software, part, astronomical, engineering, integral, quality, come, projects"
A34,RQ1,Objective and Motivation,Transforming current practices through innovations,Microservices-Based Ultra-fine-grained IoT Service Framework in SSE,0,"systems, data, security, system, privacy, users, development, computing"
A34,RQ1,Objective and Motivation,Solve existing problems and challenges,An obvious trend is to connect these scattered services as public service networks that play the role of virtualized service infrastructure to support business innovations.,0,"systems, data, security, system, privacy, users, development, computing"
A34,RQ1,Main Guidelines,Develop tools and techniques,Dynamic Composition of Individually Administered Microservices with Manageability Assurance,0,"systems, data, security, system, privacy, users, development, computing"
A34,RQ1,Impact and Applicability,Adopt new technologies and approaches,Ultra-Agile Situation-Aware Edge-Centric DevOps Platforms with AI Enablers,2,"research, open, work, future, extent, basic, also, community"
A34,RQ2,Gaps,Lack of integration between different areas of software engineering,Industry observers with keen eyes have found that services computing and software engineering are becoming more and more intertwined.,1,"software, part, astronomical, engineering, integral, quality, come, projects"
A35,RQ1,Principles and Values,Sustainability,Sustainability is systemic. Sustainability is never an isolated property. Systems thinking must be the starting point for the transdisciplinary common ground of sustainability.,0,"systems, data, security, system, privacy, users, development, computing"
A35,RQ1,Principles and Values,Architecture,Sustainability applies to both a system and its wider contexts. System design involves at least two spheres: the sustainability of the system itself and how it affects the sustainability of the wider system of which it will be part.,0,"systems, data, security, system, privacy, users, development, computing"
A35,RQ1,Call to Action,Creating a better future,Will this manifesto change how we elicit and analyze requirements? Will it change how we design software? Will it have a big impact on software engineering’s future? We’ll know that in a few years.,1,"software, part, astronomical, engineering, integral, quality, come, projects"
A35,RQ2,Gaps,Lack of evaluation and monitoring of the impact of manifestos,Even more alarming is that most software systems’ broader impacts on sustainability are unknown.,1,"software, part, astronomical, engineering, integral, quality, come, projects"
A35,RQ2,Gaps,Lack of assessment or monitoring of the quality of architecture,The system’s status and context should be visible at different abstraction levels and from different perspectives to enable participation and informed responsible choice.,0,"systems, data, security, system, privacy, users, development, computing"
A35,RQ3,Relationship with SWeBok,Software architecture,Sustainability applies to both a system and its wider contexts. System design involves at least two spheres: the sustainability of the system itself and how it affects the sustainability of the wider system of which it will be part.,0,"systems, data, security, system, privacy, users, development, computing"
A35,RQ3,Relationship with SWeBok,Software Quality,Sustainability requires action on multiple levels. Some interventions have more leverage on a system than others.,1,"software, part, astronomical, engineering, integral, quality, come, projects"
A36,RQ1,Principles and Values,User focus,Living Models provides a coherent view of the quality status of the system (integrating the perspectives of all stakeholders) which evolves together with the running systems.,0,"systems, data, security, system, privacy, users, development, computing"
A36,RQ1,Principles and Values,Openness,Living Models is attached with a novel process model focusing on change and change propagation.,4,"process, mining, data, business, provides, bridge, modeling, important"
A36,RQ1,Objective and Motivation,Responding to emerging challenges and opportunities,Service oriented systems in most cases are dynamically evolving systems.,0,"systems, data, security, system, privacy, users, development, computing"
A36,RQ1,Main Guidelines,Develop tools and techniques,We developed this paradigm based on our experience of several years of work in the area of model-driven software development with a focus on security engineering and model-based quality assurance.,1,"software, part, astronomical, engineering, integral, quality, come, projects"
A36,RQ1,Impact and Applicability,Establish standards and guidelines,The System Meta Model defines the backbone of the change management process.,4,"process, mining, data, business, provides, bridge, modeling, important"
A36,RQ2,Gaps,Lack of assessment or monitoring of the quality of architecture,Our core idea to meet these challenges is a rigorous use of models to bridge the gap between the domains and the related stakeholders.,4,"process, mining, data, business, provides, bridge, modeling, important"
A36,RQ3,Relationship with SWeBok,Software architecture,The System Meta Model defines the backbone of the change management process.,4,"process, mining, data, business, provides, bridge, modeling, important"
A36,RQ3,Relationship with SWeBok,Software Quality,Living Models provides a coherent view of the quality status of the system (integrating the perspectives of all stakeholders) which evolves together with the running systems.,0,"systems, data, security, system, privacy, users, development, computing"
A37,RQ1,Principles and Values,Artificial intelligence,To judge possible machine support for STEM research and application we need to realize that many services do not require full formalization (as computation and verification do in P1).,2,"research, open, work, future, extent, basic, also, community"
A37,RQ1,Objective and Motivation,Transforming current practices through innovations,We claim that the digitization/OCR effort should be complemented by a flexiformalization effort that makes the DMLs semantically accessible and turns mathematical documents into active documents.,2,"research, open, work, future, extent, basic, also, community"
A37,RQ1,Main Guidelines,Develop tools and techniques,The establishment of a software infrastructure with a distributed network of archives that manage the content commons and collections of semantic documents.,1,"software, part, astronomical, engineering, integral, quality, come, projects"
A37,RQ1,Call to Action,Creating a better future,In conclusion we can state that the relaxation of the black-and-white distinction of formality and informality to the flexiformality continuum opens up considerable opportunities for machine support in STEM research and applications.,2,"research, open, work, future, extent, basic, also, community"
A37,RQ2,Gaps,Lack of practical guidelines for implementing principles,Efforts are currently under way to digitize and possibly OCR large parts of the published mathematical literature and turn them into generally accessible 'Digital Mathematical Libraries'.,2,"research, open, work, future, extent, basic, also, community"
A37,RQ2,Gaps,Lack of assessment or monitoring of the quality of architecture,As soon as a larger body of mathematical theories becomes available (by marking up concepts and axioms) we can automatically search for 'views' (aka. representation theorems) that allow to import all the theorems of the source theory into the target theory.,0,"systems, data, security, system, privacy, users, development, computing"
A38,RQ1,Principles and Values,Change,There are many open challenges to be tackled. Both BPM and the IoT will benefit from a wider integration.,2,"research, open, work, future, extent, basic, also, community"
A38,RQ1,Principles and Values,Privacy and Security,Privacy by design: Identify and examine possible data protection problems when designing new technology and incorporate privacy protection into the overall design.,3,"design, principles, community, people, need, thinking, must, patterns"
A38,RQ1,Objective and Motivation,Transforming current practices through innovations,One approach to bridge the gap between IoT data and processes would be to break end-to-end models into microprocesses that represent habits and arrange them in a less prescriptive way.,4,"process, mining, data, business, provides, bridge, modeling, important"
A38,RQ1,Objective and Motivation,Create or improve tools and platforms,The coordinating unit responsible for resource provisioning has advanced knowledge about the future behavior of agents since the agents have to follow their process models and thus can provide resources with greater accuracy.,4,"process, mining, data, business, provides, bridge, modeling, important"
A38,RQ2,Gaps,Lack of evaluation and monitoring of the impact of manifestos,There is a gap between IoT data and concepts at a model level to enable behavior prediction and identify changes in behavior.,0,"systems, data, security, system, privacy, users, development, computing"
A38,RQ2,Gaps,Lack of assessment or monitoring of the quality of architecture,The IoT facilitates deriving situational knowledge when tracking and evaluating data streams.,0,"systems, data, security, system, privacy, users, development, computing"
A38,RQ3,Relationship with SWeBok,Software Quality,Privacy by design: Identify and examine possible data protection problems when designing new technology and incorporate privacy protection into the overall design.,3,"design, principles, community, people, need, thinking, must, patterns"
A38,RQ3,Relationship with SWeBok,Software Security,Privacy levels that exist at the sensor layer might be different with respect to those at the BPM one.,0,"systems, data, security, system, privacy, users, development, computing"
A39,RQ1,Principles and Values,User focus,Transparency and people’s engagement to the business over... monitoring and controlling.,4,"process, mining, data, business, provides, bridge, modeling, important"
A39,RQ1,Principles and Values,Collaboration,We advocate using the AGM meta-principles with a set of meta-values to help teams achieve superior business outcomes.,4,"process, mining, data, business, provides, bridge, modeling, important"
A39,RQ1,Principles and Values,Innovation,Achieving business agility requires finding the right balance in governance and adapting it to suit each organization’s unique conditions and timing.,4,"process, mining, data, business, provides, bridge, modeling, important"
A39,RQ1,Principles and Values,Change,The teams must develop the intrinsic ability to handle change systematically.,3,"design, principles, community, people, need, thinking, must, patterns"
A39,RQ1,Principles and Values,Architecture,The architecture of solutions should focus on optimizing the desired outcomes with the available resources.,0,"systems, data, security, system, privacy, users, development, computing"
A39,RQ1,Objective and Motivation,Transforming current practices through innovations,We exercise the freedom to revisit the discussion of these principles while preserving their fundamental essence.,3,"design, principles, community, people, need, thinking, must, patterns"
A39,RQ1,Objective and Motivation,Solve existing problems and challenges,The level of governance must always be adapted according to the organizational context.,0,"systems, data, security, system, privacy, users, development, computing"
A39,RQ1,Main Guidelines,Promote collaboration and communication,We propose an engaging research agenda encompassing 12 intriguing research lines for future endeavors.,2,"research, open, work, future, extent, basic, also, community"
A39,RQ3,Relationship with SWeBok,Software architecture,The architecture of solutions should focus on optimizing the desired outcomes with the available resources.,0,"systems, data, security, system, privacy, users, development, computing"
A39,RQ3,Relationship with SWeBok,Software Quality,The meta-values emerge as enduring beliefs or ideals shared by team members and stakeholders about what is and is not suitable or appropriate in their attitudes.,4,"process, mining, data, business, provides, bridge, modeling, important"
A39,RQ3,Relationship with SWeBok,Software Engineering Process,Governance must always be adapted according to the organizational context.,0,"systems, data, security, system, privacy, users, development, computing"
A40,RQ1,Call to Action,Adopt practices and principles,It is about developing and applying Generative AI with respect for each person’s rights and dignity to build a world that is better for our collective effort.,1,"software, part, astronomical, engineering, integral, quality, come, projects"
A41,RQ1,Main Guidelines,Establish standards and guidelines,Proposal 2: Protection Level Agreement (PLA) is proposed as the section of an agreement that contains security requirements.,0,"systems, data, security, system, privacy, users, development, computing"
A41,RQ1,Impact and Applicability,Ensure security and privacy,The high level security goal of a client is to protect its data and make it available (always and only) to the entitled users.,0,"systems, data, security, system, privacy, users, development, computing"
A41,RQ1,Impact and Applicability,Develop tools and techniques,A monitor system which controls PLA fulfilments should be developed.,0,"systems, data, security, system, privacy, users, development, computing"
A41,RQ1,Call to Action,Adopt practices and principles,Proposal 4: External metrics should be used in PLA negotiations.,0,"systems, data, security, system, privacy, users, development, computing"
A41,RQ2,Gaps,Lack of practical guidelines for implementing principles,There is no such evaluation method for operational security.,0,"systems, data, security, system, privacy, users, development, computing"
A41,RQ2,Gaps,Lack of evaluation and monitoring of the impact of manifestos,Unclear performance and benchmarking metrics are a cause of 56% of outsourcing relationship failure.,0,"systems, data, security, system, privacy, users, development, computing"
A41,RQ2,Gaps,Little attention to the evolution and adaptation of manifestos,In this article we have focused more on technical side of the agreement. One problem that we have left out is the issue of enforcement.,1,"software, part, astronomical, engineering, integral, quality, come, projects"
A41,RQ2,Gaps,Lack of assessment or monitoring of the quality of architecture,External metrics can be monitored by a client remotely. For monitoring of internal metrics special techniques should be applied to guarantee that the data may be trusted.,0,"systems, data, security, system, privacy, users, development, computing"
A41,RQ3,Relationship with SWeBok,Software Security,The crucial point in PLA negotiation is identification of metrics which describe the level of protection.,0,"systems, data, security, system, privacy, users, development, computing"
A42,RQ1,Principles and Values,Process improvement,The manifesto for applicable formal methods expresses aims and intentions. We hope it will give crucial impulses to formal methods researchers to implement a modern research agenda for developing formal methods that can arguably be used for critical software engineering research.,2,"research, open, work, future, extent, basic, also, community"
A42,RQ1,Objective and Motivation,Transforming current practices through innovations,Projects such as Ptolemy and AutoFocus can be considered rigorous top-down approaches to constructing seamless toolchains for engineering embedded software.,1,"software, part, astronomical, engineering, integral, quality, come, projects"
A42,RQ1,Main Guidelines,Address ethical and social issues,The manifesto strives to foster progress in a currently dissatisfying situation found in the science of formal methods.,2,"research, open, work, future, extent, basic, also, community"
A42,RQ1,Impact and Applicability,Develop tools and techniques,A formal method should come with tool support that prevents users from tedious work steps and helps them focus on essential and creative steps.,0,"systems, data, security, system, privacy, users, development, computing"
A42,RQ2,Gaps,Lack of evaluation and monitoring of the impact of manifestos,Data from across a representative range of samples have never been rigorously measured (e.g. using controlled method experiments).,0,"systems, data, security, system, privacy, users, development, computing"
A43,RQ1,Main Guidelines,Establish standards and guidelines,This comprehensive manifesto brings these advancements together and identifies open challenges that need to be addressed for realising the Future Generation Cloud Computing.,2,"research, open, work, future, extent, basic, also, community"
A43,RQ2,Gaps,Lack of evaluation and monitoring of the impact of manifestos,The manifesto identified the current major challenges in Cloud computing domain and summarised the state of the art along with the limitations.,0,"systems, data, security, system, privacy, users, development, computing"
A43,RQ2,Gaps,Lack of assessment or monitoring of the quality of architecture,Novel research challenges in the area of scheduling will also arise in these decentralised and heterogeneous environments.,2,"research, open, work, future, extent, basic, also, community"
A43,RQ3,Relationship with SWeBok,Software Security,Security is a major concern in ICT systems and Cloud computing is no exception.,0,"systems, data, security, system, privacy, users, development, computing"
A44,RQ1,Principles and Values,User focus,The iSBS track’s goal was to aggregate a large pool of experimental interaction data from a book search portal in order to support data analysis with multilingual and multicultural user groups.,0,"systems, data, security, system, privacy, users, development, computing"
A44,RQ1,Principles and Values,Process improvement,We propose eight principles for improving the re-use of resources in the IIR community and present concrete steps on how to achieve them.,3,"design, principles, community, people, need, thinking, must, patterns"
A44,RQ1,Objective and Motivation,Responding to emerging challenges and opportunities,This perspective paper on resource re-use intends to draw the attention of the interactive information retrieval (IIR) community to the challenges of research documentation and archiving for future use.,2,"research, open, work, future, extent, basic, also, community"
A44,RQ2,Gaps,Lack of practical guidelines for implementing principles,One of the major barriers to optimal re-use of research data is often the lack of contextualization and implicit knowledge transfer.,2,"research, open, work, future, extent, basic, also, community"
A44,RQ2,Gaps,Little attention to the evolution and adaptation of manifestos,No continuity or satisfying re-use practices appear to have been established throughout the years.,1,"software, part, astronomical, engineering, integral, quality, come, projects"
A44,RQ3,Relationship with SWeBok,Software Security,Make sure that your data collection practice follows current data protection and privacy regulations such as the General Data Protection Regulation (GDPR) in the European Union.,0,"systems, data, security, system, privacy, users, development, computing"
