FileName,ResearchQuestion,Theme,Subject,Sentence,DominantTopic,TopicKeywords
A57,RQ1,Objective and Motivation,Solve existing problems and challenges, We encountered a number of problems... we had to find ways to reduce the cost while producing the valuable return we wanted.               ,2,"research, open, work, future, extent, basic, also, community"
A57,RQ1,Main Guidelines,Adopt new technologies and approaches,We propose these principles and patterns as a 'Test Automation Manifesto'.                               ,3,"design, principles, community, people, need, thinking, must, patterns"
A57,RQ1,Main Guidelines,Develop tools and techniques, Generative test automation patterns can be used to guide test automaters in avoiding the problems in the first place.     ,3,"design, principles, community, people, need, thinking, must, patterns"
A57,RQ1,Main Guidelines,Share knowledge, We propose these principles and patterns as a 'Test Automation Manifesto'.                                  ,3,"design, principles, community, people, need, thinking, must, patterns"
A57,RQ1,Impact and Applicability,Conduct research and experiments,This can be accomplished manually either by writing the tests before the code they test (and they should fail) or by introducing defects into the SUT after the tests are written.,3,"design, principles, community, people, need, thinking, must, patterns"
A57,RQ3,Relationship with SWeBok,Software architecture,SUT API Encapsulation reduces maintenance cost by isolating tests from unimportant changes to SUT API.                  ,0,"systems, data, security, system, privacy, users, development, computing"
A57,RQ3,Relationship with SWeBok,Software Construction,Anonymous Creation Methods ensure tests are repeatable and robust.                 ,0,"systems, data, security, system, privacy, users, development, computing"
A57,RQ3,Relationship with SWeBok,Software Quality,The Test Automation Manifesto defines the principles that underlie highly effective tests.           ,3,"design, principles, community, people, need, thinking, must, patterns"
A57,RQ3,Relationship with SWeBok,Software Testing,Bad smells occur specifically in test code. They recommend a set of refactorings that can be applied to the tests to remove them.                 ,2,"research, open, work, future, extent, basic, also, community"
A58,RQ1,Principles and Values,User focus,To support validity by advancing reproducibility and comparability: reproducibility of research results is an important requirement for achieving validity in many scientific disciplines.,2,"research, open, work, future, extent, basic, also, community"
A58,RQ1,Principles and Values,Openness,Making research data accessible for reuse is in line with initiatives calling for a more ‘open science’.,2,"research, open, work, future, extent, basic, also, community"
A58,RQ1,Objective and Motivation,Responding to emerging challenges and opportunities,Some of the researchers who study social media explicitly value the freedom and creativity in this area with relatively little constraints and standards.,2,"research, open, work, future, extent, basic, also, community"
A58,RQ1,Objective and Motivation,Transforming current practices through innovations,Such efforts are often supported by funding agencies who increasingly insist on publications and research data to be shared publicly.,2,"research, open, work, future, extent, basic, also, community"
A58,RQ1,Objective and Motivation,Create or improve tools and platforms,Dedicated digital data archives have started archiving social media data.,0,"systems, data, security, system, privacy, users, development, computing"
A58,RQ1,Main Guidelines,Establish standards and guidelines,An environment that is conducive to the sharing of research data depends both on the availability of infrastructures to support archiving and data sharing.,2,"research, open, work, future, extent, basic, also, community"
A58,RQ1,Impact and Applicability,Consider context and application,Researchers should prepare documentation of major sets of data they have collected for their own use.,0,"systems, data, security, system, privacy, users, development, computing"
A58,RQ1,Impact and Applicability,Promote collaboration and communication,Publishers and conference organizers can support researchers in sharing datasets by publishing data in addition to written papers.,0,"systems, data, security, system, privacy, users, development, computing"
A58,RQ1,Call to Action,Collaborate and share,We hope that this call to action will inspire fruitful discussions and novel approaches to data sharing in the future.,4,"process, mining, data, business, provides, bridge, modeling, important"
A58,RQ2,Gaps,Lack of evaluation and monitoring of the impact of manifestos,Obstacles range from lack of incentives to the fear of opening one’s own research to attack.,2,"research, open, work, future, extent, basic, also, community"
A58,RQ2,Gaps,Little attention to the evolution and adaptation of manifestos,More research is needed on users’ privacy expectations on social media platforms.,2,"research, open, work, future, extent, basic, also, community"
A58,RQ3,Relationship with SWeBok,Software Quality,Control over data quality is crucial. Making research data accessible within the research community is a first necessary step to support reproducibility and comparability of social media research.,2,"research, open, work, future, extent, basic, also, community"
A58,RQ3,Relationship with SWeBok,Software Security,Researchers would currently have to figure out which setting may be most appropriate for their dataset – also in light of platforms’ terms of services and user privacy.,0,"systems, data, security, system, privacy, users, development, computing"
A58,RQ3,Relationship with SWeBok,Software Engineering Professional Practice,More research is needed on users’ privacy expectations on social media platforms. Ethical considerations should also be addressed in publications.,2,"research, open, work, future, extent, basic, also, community"
A59,RQ1,Principles and Values,User focus,We believe that two key factors are the need to make new concepts accessible to those comfortable with existing practice and the need to show a quick pay-back for the effort involved in embracing them.,3,"design, principles, community, people, need, thinking, must, patterns"
A59,RQ1,Principles and Values,Innovation,The skeletal approach to parallel programming is well documented in the research literature. It observes that many parallel algorithms can be characterised and classified by their adherence to one or more of a number of generic patterns of computation and interaction.,2,"research, open, work, future, extent, basic, also, community"
A59,RQ1,Principles and Values,Process improvement,The goal of the eSkel library is to add such higher-level collective operations to the MPI programmer’s toolbox.,2,"research, open, work, future, extent, basic, also, community"
A59,RQ1,Principles and Values,Change,We argue for a more pragmatic approach than has previously been adopted in order to enhance accessibility.,1,"software, part, astronomical, engineering, integral, quality, come, projects"
A59,RQ1,Principles and Values,Architecture,We must be careful to draw a balance between our desire for abstract simplicity and the pragmatic need for flexibility. This is not a quantifiable trade-off.,3,"design, principles, community, people, need, thinking, must, patterns"
A59,RQ1,Main Guidelines,Develop tools and techniques,The eSkel library is a library of C function and type definitions which extend the standard C binding to MPI with skeletal operations.,0,"systems, data, security, system, privacy, users, development, computing"
A59,RQ1,Main Guidelines,Establish standards and guidelines,We must construct our systems to allow the integration of skeletal and ad-hoc parallelism in a well-defined way.,0,"systems, data, security, system, privacy, users, development, computing"
A59,RQ1,Call to Action,Adopt new technologies and approaches,We must also be able to show that there are benefits which outweigh the initial overheads and that it is possible to experience these early on the learning curve.,2,"research, open, work, future, extent, basic, also, community"
A59,RQ2,Gaps,Lack of evaluation and monitoring of the impact of manifestos,Yet skeletal programming has still to make a substantial impact on mainstream practice in parallel applications programming.,2,"research, open, work, future, extent, basic, also, community"
A59,RQ3,Relationship with SWeBok,Software architecture,We present four principles which we believe should guide the future design and development of skeletal programming systems.,3,"design, principles, community, people, need, thinking, must, patterns"
A59,RQ3,Relationship with SWeBok,Software Quality,We must be careful to draw a balance between our desire for abstract simplicity and the pragmatic need for flexibility.,3,"design, principles, community, people, need, thinking, must, patterns"
A60,RQ1,Principles and Values,Innovation,There is an explosion of available open-data online which is accessed and analysed through the creation of new software – generating more data to analyse.,1,"software, part, astronomical, engineering, integral, quality, come, projects"
A60,RQ1,Principles and Values,Ethics and Responsibility,I will contribute to sustaining software I use and rely on.,1,"software, part, astronomical, engineering, integral, quality, come, projects"
A60,RQ1,Principles and Values,Process improvement,I will match proposed software engineering practices to the actual needs and resources of the project.,1,"software, part, astronomical, engineering, integral, quality, come, projects"
A60,RQ1,Objective and Motivation,Responding to emerging challenges and opportunities,The goals of the workshop were to plan how to widen and deepen the impact of software engineering knowledge in research labs across the globe and to prioritize pressing open questions for the software engineering community with respect to research software.,1,"software, part, astronomical, engineering, integral, quality, come, projects"
A60,RQ1,Main Guidelines,Adopt new technologies and approaches,I will make explicit how to cite my software. I will cite the software I used to produce my research results.,1,"software, part, astronomical, engineering, integral, quality, come, projects"
A60,RQ2,Gaps,Lack of evaluation and monitoring of the impact of manifestos,How can we verify (test or prove) our claims? Is the software that drives our research methods correct? Are the inputs and outputs sufficiently specified to be able to interpret the difference between incorrect and correct?,2,"research, open, work, future, extent, basic, also, community"
A60,RQ3,Relationship with SWeBok,Software Requirements,What is academic software? How does it differ from other software? What are its most pressing dimensions of quality? What are the major success factors?,1,"software, part, astronomical, engineering, integral, quality, come, projects"
A60,RQ3,Relationship with SWeBok,Software Quality,Is the software process we use fit for the quality we expect? How can we optimize it in a unique academic context without losing quality?,1,"software, part, astronomical, engineering, integral, quality, come, projects"
A61,RQ1,Principles and Values,Openness,We need to fix these vulnerabilities sooner rather than later.,3,"design, principles, community, people, need, thinking, must, patterns"
A61,RQ1,Principles and Values,Ethics and Responsibility,Memory safety has risen to the level of a public policy concern.,0,"systems, data, security, system, privacy, users, development, computing"
A61,RQ1,Principles and Values,Privacy and Security,From 2019 to 2022 [the number of memory safety vulnerabilities] has dropped from 76% down to 35% of Android’s total vulnerabilities.,0,"systems, data, security, system, privacy, users, development, computing"
A61,RQ1,Principles and Values,Architecture,Rust programs can offer a guarantee of memory safety without giving up the performance and low-level features that C programmers demand.,3,"design, principles, community, people, need, thinking, must, patterns"
A61,RQ1,Objective and Motivation,Criticism of the current situation and the need for cultural change,Memory safety has risen to the level of a public policy concern.,0,"systems, data, security, system, privacy, users, development, computing"
A61,RQ1,Main Guidelines,Adopt new technologies and approaches,Virtually every Android app is written in Java or Kotlin. Both are memory safe programming languages.,3,"design, principles, community, people, need, thinking, must, patterns"
A61,RQ1,Main Guidelines,Develop tools and techniques,Rust is novel for not requiring garbage collection and for allowing objects to live on the stack or the heap.,4,"process, mining, data, business, provides, bridge, modeling, important"
A61,RQ1,Main Guidelines,Establish standards and guidelines,Memory safety is no longer optional. Computer software must be developed with memory safety as a baseline requirement.,1,"software, part, astronomical, engineering, integral, quality, come, projects"
A61,RQ1,Impact and Applicability,Ensure security and privacy,Memory safety vulnerabilities no longer represent a majority of Android’s vulnerabilities.,0,"systems, data, security, system, privacy, users, development, computing"
A61,RQ1,Call to Action,Adopt new technologies and approaches,It’s time for a new approach. This manifesto argues that we must commit to rewriting the world’s software in 'safe' languages that eliminate these issues up front.,1,"software, part, astronomical, engineering, integral, quality, come, projects"
A61,RQ1,Call to Action,Creating a better future,We need to do better. We need to fix these vulnerabilities sooner rather than later.,3,"design, principles, community, people, need, thinking, must, patterns"
A61,RQ2,Gaps,Lack of evaluation and monitoring of the impact of manifestos,Future static analyzers may be able to provide these guarantees for code written exclusively with modern C++ features.,2,"research, open, work, future, extent, basic, also, community"
A61,RQ3,Relationship with SWeBok,Software architecture,Rust programs can offer a guarantee of memory safety without giving up the performance and low-level features that C programmers demand.,3,"design, principles, community, people, need, thinking, must, patterns"
A61,RQ3,Relationship with SWeBok,Software Security,Memory safety vulnerabilities no longer represent a majority of Android’s vulnerabilities.,0,"systems, data, security, system, privacy, users, development, computing"
A61,RQ3,Relationship with SWeBok,Software Quality,Google reports that '[f]rom 2019 to 2022 [the number of memory safety vulnerabilities] has dropped from 76% down to 35% of Android’s total vulnerabilities.',0,"systems, data, security, system, privacy, users, development, computing"
A62,RQ1,Objective and Motivation,Create or improve tools and platforms,We introduce the concept of Dataware as the logical federation of data sources containing 'my data' and discuss an SOA to deliver new and compelling services and applications able to reap the benefits of this value chain.,0,"systems, data, security, system, privacy, users, development, computing"
A62,RQ3,Relationship with SWeBok,Software Security,Making available the data to software running on the individual’s behalf avoids many legitimate privacy issues and concerns.,1,"software, part, astronomical, engineering, integral, quality, come, projects"
A63,RQ1,Principles and Values,Artificial intelligence,The goal here is to identify key directions for the future advanced research initiatives in Artificial Intelligence (AI) and beyond.,2,"research, open, work, future, extent, basic, also, community"
A63,RQ1,Objective and Motivation,Solve existing problems and challenges,The expected impact on the society will be immense and crucial for its survival.,2,"research, open, work, future, extent, basic, also, community"
A63,RQ1,Main Guidelines,Develop tools and techniques,Forms of implementation will range from virtual entities to wearable electronics and autonomous robots.,2,"research, open, work, future, extent, basic, also, community"
A63,RQ1,Impact and Applicability,Promote collaboration and communication,Its principles will combine preprogrammed basic functions and its own natural ontogeny in a virtual social environment.,3,"design, principles, community, people, need, thinking, must, patterns"
A64,RQ1,Principles and Values,Innovation,Our software tools—particularly in the collaboration space—are nowhere close to fulfilling their potential.,1,"software, part, astronomical, engineering, integral, quality, come, projects"
A64,RQ1,Principles and Values,Openness,Open source software offers an excellent and underutilized avenue for disseminating innovations in user interface.,1,"software, part, astronomical, engineering, integral, quality, come, projects"
A64,RQ1,Principles and Values,Ethics and Responsibility,Computers should help us become smarter and work together better. Remembering this will keep us on the right track.,2,"research, open, work, future, extent, basic, also, community"
A64,RQ1,Main Guidelines,Adopt new technologies and approaches,Our software tools—particularly in the collaboration space—are nowhere close to fulfilling their potential.,1,"software, part, astronomical, engineering, integral, quality, come, projects"
A64,RQ1,Main Guidelines,Develop tools and techniques,Creating a shared conceptual framework is a truly collaborative problem.,2,"research, open, work, future, extent, basic, also, community"
A64,RQ1,Main Guidelines,Promote collaboration and communication,Working together will both strengthen this community and improve our tools.,3,"design, principles, community, people, need, thinking, must, patterns"
A64,RQ1,Impact and Applicability,Adapt and evolve,Keep improving. Improvement is an ongoing process.,4,"process, mining, data, business, provides, bridge, modeling, important"
A64,RQ2,Gaps,Lack of practical guidelines for implementing principles,The problem with usability is not a lack of good ideas; it's that most of these ideas never make it into real applications.,0,"systems, data, security, system, privacy, users, development, computing"
A65,RQ1,Principles and Values,Sustainability,‘Green IT’ being just one of the latest buzzword that characterize this trend.,0,"systems, data, security, system, privacy, users, development, computing"
A65,RQ1,Objective and Motivation,Responding to emerging challenges and opportunities,What are the critical issues that emerge during RE in this brave new world?,3,"design, principles, community, people, need, thinking, must, patterns"
A65,RQ1,Objective and Motivation,Transforming current practices through innovations,The research scope of RE has to become more interdisciplinary and it needs to also carefully evaluate some of its critical assumptions that underlie current research and practice.,2,"research, open, work, future, extent, basic, also, community"
A65,RQ2,Gaps,Lack of assessment or monitoring of the quality of architecture,How do architectures influence the evolution of requirements and their identification?,0,"systems, data, security, system, privacy, users, development, computing"
A65,RQ3,Relationship with SWeBok,Software architecture,Architectural dependences arise in the approaches of IKIWISI (I’ll Know It When I See It) and COTS (Commercial off-the-shelf) software deployment.,1,"software, part, astronomical, engineering, integral, quality, come, projects"
A65,RQ3,Relationship with SWeBok,Software Quality,What types of interdependencies influence and affect system change and create higher levels of design complexity?,3,"design, principles, community, people, need, thinking, must, patterns"
A66,RQ1,Principles and Values,User focus,Our manifesto places emphasis on the scholarly value of academic software.,1,"software, part, astronomical, engineering, integral, quality, come, projects"
A66,RQ1,Principles and Values,Openness,I will develop software as open source right from the start whenever possible.,1,"software, part, astronomical, engineering, integral, quality, come, projects"
A66,RQ1,Principles and Values,Ethics and Responsibility,It is more in the style of a personal responsibility pledge like those on open access and open peer review.,2,"research, open, work, future, extent, basic, also, community"
A66,RQ1,Main Guidelines,Adopt new technologies and approaches,I will match software engineering practices I recommend to the needs and resources of projects.,1,"software, part, astronomical, engineering, integral, quality, come, projects"
A66,RQ1,Impact and Applicability,Develop tools and techniques,I will document my academic software for users with instructions and examples.,1,"software, part, astronomical, engineering, integral, quality, come, projects"
A66,RQ1,Impact and Applicability,Ensure security and privacy,I will examine the source code of academic software contributions and encourage others to do so as well.,1,"software, part, astronomical, engineering, integral, quality, come, projects"
A66,RQ1,Call to Action,Share knowledge,I will publish the intellectual contributions of my research software.,2,"research, open, work, future, extent, basic, also, community"
A66,RQ3,Relationship with SWeBok,Software Engineering Professional Practice,I will properly cite software used to produce my research results.,2,"research, open, work, future, extent, basic, also, community"
A67,RQ1,Principles and Values,Innovation,The research in both fog and edge computing is growing day by day since they emerged as groundbreaking computing paradigms.,2,"research, open, work, future, extent, basic, also, community"
A67,RQ1,Principles and Values,Openness,There is a need to assess the existing research related to emerging paradigms to find out the possible future directions and research opportunities existing in this field.,2,"research, open, work, future, extent, basic, also, community"
A67,RQ1,Principles and Values,Ethics and Responsibility,Security and privacy are two important challenges in computing system while delivering services to end users.,0,"systems, data, security, system, privacy, users, development, computing"
A67,RQ1,Principles and Values,Artificial intelligence,Effective use of AI techniques can enhance the energy efficiency and reliability of the CDC.,1,"software, part, astronomical, engineering, integral, quality, come, projects"
A67,RQ1,Principles and Values,Privacy and Security,Privacy-aware fog and edge computing system allow authentic users to access their data using various IoT applications.,0,"systems, data, security, system, privacy, users, development, computing"
A67,RQ1,Objective and Motivation,Emphasis on collaboration and interdisciplinarity,Fog and edge computing helps critical IoT applications to maintain the SLA during the processing of user requests in an efficient manner before their deadline.,0,"systems, data, security, system, privacy, users, development, computing"
A67,RQ1,Main Guidelines,Adopt new technologies and approaches,The research in both fog and edge computing is growing day by day since they emerged as groundbreaking computing paradigms.,2,"research, open, work, future, extent, basic, also, community"
A67,RQ1,Main Guidelines,Develop tools and techniques,Fog and edge computing paradigms can be used for proficient big data analytics to improve data processing.,0,"systems, data, security, system, privacy, users, development, computing"
A67,RQ1,Impact and Applicability,Develop tools and techniques,Resource provisioning is defined as the filtering of best matched resources based on the QoS requirements of the requests.,0,"systems, data, security, system, privacy, users, development, computing"
A67,RQ1,Impact and Applicability,Ensure security and privacy,There is a need of proactive privacy and security-aware systems to protect user data and handle security attacks.,0,"systems, data, security, system, privacy, users, development, computing"
A67,RQ2,Gaps,Lack of practical guidelines for implementing principles,How to provision fog and edge resources effectively for different IoT applications before actual scheduling of resources?,0,"systems, data, security, system, privacy, users, development, computing"
A67,RQ2,Gaps,Little discussion of the social and political implications of technology,There is a need to assess the existing research related to emerging paradigms to find out the possible future directions and research opportunities existing in this field.,2,"research, open, work, future, extent, basic, also, community"
A67,RQ2,Gaps,Lack of integration between different areas of software engineering,Fog and edge computing helps critical IoT applications to maintain the SLA during the processing of user requests in an efficient manner before their deadline.,0,"systems, data, security, system, privacy, users, development, computing"
A67,RQ3,Relationship with SWeBok,Software Security,Security and privacy are two important challenges in computing system while delivering services to end users.,0,"systems, data, security, system, privacy, users, development, computing"
A68,RQ1,Principles and Values,Collaboration,We present our vision to develop semantic diff operators for model comparisons.,4,"process, mining, data, business, provides, bridge, modeling, important"
A68,RQ1,Principles and Values,Ethics and Responsibility,Such diff witnesses serve as concrete proofs for the real change between one version and another and its effect on the meaning of the models involved.,4,"process, mining, data, business, provides, bridge, modeling, important"
