FileName,ResearchQuestion,Theme,Subject,Sentence,DominantTopic,TopicKeywords
A100,RQ3,Relationship with SWeBok,Software Quality,Formal methods are employed during system-development process to improve the quality of the system.,4,"process, mining, data, business, provides, bridge, modeling, important"
A100,RQ3,Relationship with SWeBok,Software Security,Several current standards for transportation systems highly recommend abstract interpretation and model checking for systems at the highest criticality level.,0,"systems, data, security, system, privacy, users, development, computing"
A101,RQ1,Principles and Values,Innovation,algorithmic art is its radical form.,2,"research, open, work, future, extent, basic, also, community"
A101,RQ1,Principles and Values,Architecture,the class in algorithmic art also exists as an operational entity of generative power.,2,"research, open, work, future, extent, basic, also, community"
A101,RQ1,Main Guidelines,Establish standards and guidelines,rigorously the class is described by its parameters.,4,"process, mining, data, business, provides, bridge, modeling, important"
A101,RQ1,Impact and Applicability,Adapt and evolve,thinking the work forces you to think of sets and classes of works.,3,"design, principles, community, people, need, thinking, must, patterns"
A101,RQ1,Call to Action,Building and strengthening communities,thinking the work forces you to think of sets and classes of works.,3,"design, principles, community, people, need, thinking, must, patterns"
A101,RQ2,Gaps,Little attention to the evolution and adaptation of manifestos,the class remains invisible forever but it occasionally appears as one piece or another.,4,"process, mining, data, business, provides, bridge, modeling, important"
A101,RQ3,Relationship with SWeBok,Software architecture,the class in algorithmic art also exists as an operational entity of generative power.,2,"research, open, work, future, extent, basic, also, community"
A103,RQ1,Main Guidelines,Develop tools and techniques,Actor-relational database systems hold promise to provide abstractions to manage cross-actor heterogeneity under a unified database programming model.,0,"systems, data, security, system, privacy, users, development, computing"
A104,RQ1,Principles and Values,User focus,Astronomical software is now a fact of daily life for all hands-on members of the astronomy and astrophysics community.,1,"software, part, astronomical, engineering, integral, quality, come, projects"
A104,RQ1,Principles and Values,Innovation,We advocate that: (1) the astronomical community consider software as an integral and fundable part of facility construction and science programs.,1,"software, part, astronomical, engineering, integral, quality, come, projects"
A104,RQ1,Principles and Values,Openness,We argue that the astronomical community’s increasing dependence on software and analysis requires that it come to see software as an integral part of its scientific practice.,1,"software, part, astronomical, engineering, integral, quality, come, projects"
A104,RQ1,Principles and Values,Ethics and Responsibility,We should develop institutional support for science programs that attract and support talented scientists who generate software for public release.,1,"software, part, astronomical, engineering, integral, quality, come, projects"
A104,RQ1,Principles and Values,Process improvement,We argue that the astronomical community’s increasing dependence on software and analysis requires that it come to see software as an integral part of its scientific practice.,1,"software, part, astronomical, engineering, integral, quality, come, projects"
A104,RQ1,Principles and Values,Artificial intelligence,We should encourage interdisciplinary cooperation with like-minded and algorithmically sophisticated members of the computer science community.,2,"research, open, work, future, extent, basic, also, community"
A104,RQ1,Principles and Values,Privacy and Security,The community should consider how best to link publications to released electronic products; printing web addresses in papers is prone to link rot.,3,"design, principles, community, people, need, thinking, must, patterns"
A104,RQ1,Principles and Values,Sustainability,Providing a stable career path for scientists with these skills would benefit a wide range of projects and future surveys.,2,"research, open, work, future, extent, basic, also, community"
A104,RQ1,Principles and Values,Architecture,Software release should be an integral and funded part of astronomical projects.,1,"software, part, astronomical, engineering, integral, quality, come, projects"
A104,RQ1,Objective and Motivation,Responding to emerging challenges and opportunities,We argue that the astronomical community’s increasing dependence on software and analysis requires that it come to see software as an integral part of its scientific practice.,1,"software, part, astronomical, engineering, integral, quality, come, projects"
A104,RQ1,Objective and Motivation,Solve existing problems and challenges,Software release should be an integral and funded part of astronomical projects.,1,"software, part, astronomical, engineering, integral, quality, come, projects"
A104,RQ1,Main Guidelines,Develop tools and techniques,We should create more opportunities to fund grass-roots software projects of use to the wider community.,1,"software, part, astronomical, engineering, integral, quality, come, projects"
A104,RQ1,Main Guidelines,Establish standards and guidelines,The community should consider how best to link publications to released electronic products.,3,"design, principles, community, people, need, thinking, must, patterns"
A104,RQ1,Impact and Applicability,Promote collaboration and communication,We should encourage interdisciplinary cooperation with like-minded and algorithmically sophisticated members of the computer science community.,2,"research, open, work, future, extent, basic, also, community"
A104,RQ2,Gaps,Little discussion of the social and political implications of technology,Recognizing the disincentives to software work and its release as a problem and addressing it does not mean throwing money at it by increasing the size of programming teams.,1,"software, part, astronomical, engineering, integral, quality, come, projects"
A104,RQ3,Relationship with SWeBok,Software architecture,Software release should be an integral and funded part of astronomical projects.,1,"software, part, astronomical, engineering, integral, quality, come, projects"
A104,RQ3,Relationship with SWeBok,Software Quality,We argue that the astronomical community’s increasing dependence on software and analysis requires that it come to see software as an integral part of its scientific practice.,1,"software, part, astronomical, engineering, integral, quality, come, projects"
A104,RQ3,Relationship with SWeBok,Software Security,The community should consider how best to link publications to released electronic products; printing web addresses in papers is prone to link rot.,3,"design, principles, community, people, need, thinking, must, patterns"
A106,RQ3,Relationship with SWeBok,Software architecture,Standardised roles and pathways for career development: Professionalisation also improves the integration of TIRs within research organisational structures.,2,"research, open, work, future, extent, basic, also, community"
A107,RQ1,Principles and Values,Collaboration,The workshop studied different visions and different approaches to the development and management of different kinds of complex systems.,0,"systems, data, security, system, privacy, users, development, computing"
A107,RQ1,Principles and Values,Innovation,MDE may provide the right level of abstraction to move the study of complex systems from an informal goal to more concrete grounds.,0,"systems, data, security, system, privacy, users, development, computing"
A107,RQ1,Principles and Values,Architecture,A CBCS has a structure (or static architecture) and a dynamic behaviour.,0,"systems, data, security, system, privacy, users, development, computing"
A107,RQ1,Objective and Motivation,Responding to emerging challenges and opportunities,There are currently few engineering methods and tools to deal with them in practice.,1,"software, part, astronomical, engineering, integral, quality, come, projects"
A107,RQ1,Objective and Motivation,Transforming current practices through innovations,Managing the accidental complexity accumulated by many layers of technological legacy is an important challenge in the management of CBCSs.,4,"process, mining, data, business, provides, bridge, modeling, important"
A107,RQ2,Gaps,Lack of practical guidelines for implementing principles,There was also discussion on industrial needs for MDE and CBCS. Participants discussed the benefits from having process support for MDE of CBCS.,4,"process, mining, data, business, provides, bridge, modeling, important"
A107,RQ3,Relationship with SWeBok,Software architecture,A CBCS has a structure (or static architecture) and a dynamic behaviour.,0,"systems, data, security, system, privacy, users, development, computing"
A108,RQ1,Principles and Values,Innovation,The emergence of ecosystems for dynamic and intelligent platform-based systems overthrows traditional principles of organizational design.,3,"design, principles, community, people, need, thinking, must, patterns"
A108,RQ1,Principles and Values,Process improvement,The fast pace of technology developments urges management research to address the future related management challenges more proactively.,2,"research, open, work, future, extent, basic, also, community"
A108,RQ1,Objective and Motivation,Transforming current practices through innovations,New perspectives on the links between the system architecture and the organization need to be developed as a result of the emergence of ecosystems.,0,"systems, data, security, system, privacy, users, development, computing"
A108,RQ1,Main Guidelines,Address ethical and social issues,Research in this area can contribute to the successful combination of these two contrasting logics.,2,"research, open, work, future, extent, basic, also, community"
A108,RQ1,Impact and Applicability,Adapt and evolve,The ongoing extensive research on systems and technologies for complex intelligent systems creates a unique possibility to proactively address the management challenges.,2,"research, open, work, future, extent, basic, also, community"
A109,RQ1,Principles and Values,User focus,Supporting the Inclusive Web: Datafication of businesses may make unfair practices of enterprises more visible. Society is less willing to accept these and expects companies to take advantage of available data and make their businesses more inclusive.,0,"systems, data, security, system, privacy, users, development, computing"
A109,RQ1,Principles and Values,Innovation,Challenge – Tooling: Leverage AI tools for Web Science.,3,"design, principles, community, people, need, thinking, must, patterns"
A109,RQ1,Principles and Values,Ethics and Responsibility,How do we ensure that Web technologies are ethical? That they are designed and implemented in ways that take into account potential harms?,3,"design, principles, community, people, need, thinking, must, patterns"
A109,RQ2,Gaps,Lack of evaluation and monitoring of the impact of manifestos,We explain issues that society faces in the Web by the ambivalences that are inherent in the Web. All the enormous benefits that the Web offers will always carry along negative consequences.,3,"design, principles, community, people, need, thinking, must, patterns"
A109,RQ2,Gaps,Little attention to the evolution and adaptation of manifestos,Web Science must engage with multiple and often competing stakeholders.,3,"design, principles, community, people, need, thinking, must, patterns"
A109,RQ3,Relationship with SWeBok,Software Security,Privacy violations can result from the mathematical-technical aspects of the Web as a communication medium.,3,"design, principles, community, people, need, thinking, must, patterns"
A110,RQ1,Principles and Values,Process improvement,To help avoid software erosion costs,1,"software, part, astronomical, engineering, integral, quality, come, projects"
A110,RQ1,Principles and Values,Architecture,The 12-factor app methodology has emerged to handle the dissonance between traditional app development and modern cloud solutions.,0,"systems, data, security, system, privacy, users, development, computing"
A110,RQ1,Objective and Motivation,Solve existing problems and challenges,To raise awareness of systemic problems they’ve observed in modern app development.,0,"systems, data, security, system, privacy, users, development, computing"
A110,RQ1,Main Guidelines,Adopt new technologies and approaches,12-factor apps must always be independent from additional applications. Every function should be its own process—in full isolation.,0,"systems, data, security, system, privacy, users, development, computing"
A110,RQ1,Call to Action,Adopt new technologies and approaches,A true 12-factor app is designed for scaling. Build your applications so that scaling in the cloud is seamless.,0,"systems, data, security, system, privacy, users, development, computing"
A110,RQ2,Gaps,Lack of evaluation and monitoring of the impact of manifestos,There should be only the slightest difference between development and production environments. A vast difference may lead to unintended compatibility issues.,0,"systems, data, security, system, privacy, users, development, computing"
A110,RQ3,Relationship with SWeBok,Software architecture,A 12-factor app must always be independent from additional applications. Every function should be its own process—in full isolation.,0,"systems, data, security, system, privacy, users, development, computing"
A110,RQ3,Relationship with SWeBok,Software Construction,Your code base should have a logical version control system that’s easy to understand. Every deployment should have its own code repository.,0,"systems, data, security, system, privacy, users, development, computing"
A111,RQ1,Principles and Values,Ethics and Responsibility,The rule of free competition is needed for the applied know-how embodied in these products... should be tailored to ensure that it will not impede competition any more than is necessary to correct the market failure it addresses.,2,"research, open, work, future, extent, basic, also, community"
A111,RQ1,Main Guidelines,Address ethical and social issues,There is a strong societal interest in permitting the use of publicly accessible technical information that is unprotected by patent or copyright law.,0,"systems, data, security, system, privacy, users, development, computing"
A111,RQ1,Call to Action,Challenge the status quo,Existing legal regimes are structurally unsuited to providing an appropriate degree of protection to compiled know-how lying on or near the face of software products.,1,"software, part, astronomical, engineering, integral, quality, come, projects"
A111,RQ2,Gaps,Lack of practical guidelines for implementing principles,No legal regime can solve all problems [â€¦] Our goal was to concentrate on a workable solution to the most serious problems.,2,"research, open, work, future, extent, basic, also, community"
A111,RQ2,Gaps,Little discussion of the social and political implications of technology,The rule of free competition is needed [â€¦] to correct the market failure.,2,"research, open, work, future, extent, basic, also, community"
A111,RQ2,Gaps,Lack of assessment or monitoring of the quality of architecture,Existing legal regimes are structurally unsuited to providing an appropriate degree of protection to compiled know-how lying on or near the face of software products.,1,"software, part, astronomical, engineering, integral, quality, come, projects"
A111,RQ3,Relationship with SWeBok,Software Engineering Professional Practice,Developers routinely make agreements with royalty provisions when they want to package another firmâ€™s product along with theirs.,4,"process, mining, data, business, provides, bridge, modeling, important"
A112,RQ1,Principles and Values,Change,Improvements on the traditional computing models and paradigms are required.,4,"process, mining, data, business, provides, bridge, modeling, important"
A112,RQ2,Gaps,Lack of evaluation and monitoring of the impact of manifestos,Most developments are still largely at the prototype stage. There are experiments and some case-studies but these have been ad hoc rather than methodical and systematic in testing.,2,"research, open, work, future, extent, basic, also, community"
A112,RQ3,Relationship with SWeBok,Software Design,Agent-oriented software engineering [...] has a strong emphasis on practical use in industry.,1,"software, part, astronomical, engineering, integral, quality, come, projects"
A113,RQ2,Gaps,Lack of practical guidelines for implementing principles,There is much research and appraisal to be done in terms of working through how to conceptualize code and its work. It seems to us that there is a critical need for more detailed ethnographic studies of how developers produce code.,2,"research, open, work, future, extent, basic, also, community"
A113,RQ2,Gaps,Lack of evaluation and monitoring of the impact of manifestos,There has not been enough detailed comparative exploration of the discursive regime of different software products and system configurations in separate locations.,1,"software, part, astronomical, engineering, integral, quality, come, projects"
A113,RQ3,Relationship with SWeBok,Software Quality,Code makes a difference to the nature of objects because it imbues them with the capacity to do additional and new types of work.,3,"design, principles, community, people, need, thinking, must, patterns"
A113,RQ3,Relationship with SWeBok,Software Engineering Models and Methods,We believe it would be instructive to conduct a detailed archeology of how algorithms come to be constructed â€” to excavate the social lives of ideas into code â€” and how an algorithm then translates and mutates across projects to be reemployed in diverse ways.,1,"software, part, astronomical, engineering, integral, quality, come, projects"
A114,RQ1,Principles and Values,Change,We take the bold step of naming this general paradigm for proving theorems. We call it the computational method.,3,"design, principles, community, people, need, thinking, must, patterns"
A114,RQ1,Objective and Motivation,Solve existing problems and challenges,Use of the computational method allows the researcher to concentrate on understanding the structure of the problem.,0,"systems, data, security, system, privacy, users, development, computing"
A114,RQ1,Main Guidelines,Establish standards and guidelines,Some guidelines should be established to ensure that proofs via the computational method are rigorous.,0,"systems, data, security, system, privacy, users, development, computing"
A114,RQ1,Main Guidelines,Consider context and application,We illustrate the usefulness of the method by analyzing a randomized algorithm for multi-processor scheduling with rejection.,0,"systems, data, security, system, privacy, users, development, computing"
A114,RQ1,Call to Action,Challenge the status quo,We shall take the outrageous position of defending computer assisted proofs.,3,"design, principles, community, people, need, thinking, must, patterns"
A114,RQ1,Call to Action,Creating a better future,Hopefully all goes well and the theorem is proven.,3,"design, principles, community, people, need, thinking, must, patterns"
A114,RQ3,Relationship with SWeBok,Software Engineering Models and Methods,This method seems to be especially useful in theoretical computer science. Our goal is to bound the cost incurred when a given algorithm encounters an input.,2,"research, open, work, future, extent, basic, also, community"
A115,RQ2,Gaps,Lack of integration between different areas of software engineering,XAI-based systems need to start from modeling the biomedical and clinical domain in order to obtain a true understanding of the context in which these systems will be used.,0,"systems, data, security, system, privacy, users, development, computing"
A115,RQ3,Relationship with SWeBok,Software Requirements,Functional specifications obtained from deep analysis of the problem domain and users should determine when explainability and interpretability are required.,0,"systems, data, security, system, privacy, users, development, computing"
A116,RQ1,Principles and Values,Collaboration,Collaboration over individual accomplishment. Experience with collaborative work also prepares students to work effectively in teams.,2,"research, open, work, future, extent, basic, also, community"
A116,RQ1,Principles and Values,Process improvement,Continuous improvement over the maintenance of current practices.,4,"process, mining, data, business, provides, bridge, modeling, important"
A116,RQ3,Relationship with SWeBok,Software Quality,Agile techniques enhanced the quality of their class project deliverables.,4,"process, mining, data, business, provides, bridge, modeling, important"
A117,RQ1,Principles and Values,Collaboration,We understand the importance of collaboration between development team and the client. This focus on the client is often missing in education.,0,"systems, data, security, system, privacy, users, development, computing"
A117,RQ1,Principles and Values,Ethics and Responsibility,Teachers could then spend more time solving difficulties of the students than lecturing.,4,"process, mining, data, business, provides, bridge, modeling, important"
A117,RQ3,Relationship with SWeBok,Software Engineering Process,Evaluation could be done continuously in small increments to avoid few big-bang evaluations scheduled at periodic intervals.,4,"process, mining, data, business, provides, bridge, modeling, important"
A119,RQ3,Relationship with SWeBok,Software Engineering Professional Practice,Practitioners are happier because IS programs are producing graduates with up-to-date technology skills as well as organizational skills.,3,"design, principles, community, people, need, thinking, must, patterns"
A121,RQ1,Principles and Values,Innovation,ACI could expand the horizon of user-computer interaction research by pushing our imagination beyond the boundaries of human-computer interaction.,2,"research, open, work, future, extent, basic, also, community"
A121,RQ2,Gaps,Lack of practical guidelines for implementing principles,How do we elicit requirements from a nonhuman participant? How do we involve them in the design process? How do we evaluate the technology we develop for them?,3,"design, principles, community, people, need, thinking, must, patterns"
A121,RQ2,Gaps,Little discussion of the social and political implications of technology,The study of how they are adopted by or affect their users remains fundamentally outside the remit of user-computer interaction research.,2,"research, open, work, future, extent, basic, also, community"
A121,RQ2,Gaps,Lack of integration between different areas of software engineering,ACI has so far been driven by academic disciplines other than computer science or by other industrial sectors.,2,"research, open, work, future, extent, basic, also, community"
A121,RQ3,Relationship with SWeBok,Software Requirements,We could look at human-centered interaction design protocols and methods to assess which ones may or may not be relevant to an animal-centered design process.,3,"design, principles, community, people, need, thinking, must, patterns"
A122,RQ1,Principles and Values,Collaboration,Group collaboration requires a high degree of flexibility and malleability in the systems that support the work.,0,"systems, data, security, system, privacy, users, development, computing"
A122,RQ1,Principles and Values,Change,Supporting cooperation requires the system to be capable of reflecting both the changes that are decided for its performances and the continuously ongoing changes of the practices of its members.,0,"systems, data, security, system, privacy, users, development, computing"
A122,RQ2,Gaps,Little attention to the evolution and adaptation of manifestos,It is continuous organizational and technological change that makes cooperative information systems a challenge.,0,"systems, data, security, system, privacy, users, development, computing"
A122,RQ3,Relationship with SWeBok,Software architecture,We propose a generic architecture for cooperative information systems intended to support the rapid construction and evolution on top of existing organizational and technical legacy.,0,"systems, data, security, system, privacy, users, development, computing"
A122,RQ3,Relationship with SWeBok,Software Quality,System cooperation now imposes a series of new requirements concerning the modeling and representation of higher level functions... and the allocation of system resources to their execution.,0,"systems, data, security, system, privacy, users, development, computing"
A123,RQ1,Principles and Values,Process improvement,Systems integration typically starts as ad-hoc guesswork that progresses haphazardly via probes to characterize system behavior and expand the area of correct behavior.,0,"systems, data, security, system, privacy, users, development, computing"
A123,RQ1,Principles and Values,Change,Supporting cooperation requires the system to be capable of reflecting both the changes that are decided for its performances and the continuously ongoing changes of the practices of its members.,0,"systems, data, security, system, privacy, users, development, computing"
