FileName,ResearchQuestion,Theme,Subject,Sentence,DominantTopic,TopicKeywords
A1,RQ1,Principles and Values,User focus,Usability: C&C technology must match human abilities of both the operators and the end users.,0,"systems, data, security, system, privacy, users, development, computing"
A1,RQ1,Principles and Values,Privacy and Security,Security/Privacy: We must protect the security and privacy of C&C users from criminals and terrorists while preventing the Orwellian vision of Big Brother.,0,"systems, data, security, system, privacy, users, development, computing"
A1,RQ1,Principles and Values,Architecture,Massively Parallel Microprocessors. [...] another bold challenge is how to advance the SPUR manifesto when the hardware building block is a computer rather than a transistor.,3,"design, principles, community, people, need, thinking, must, patterns"
A1,RQ1,Objective and Motivation,Criticism of the current situation and the need for cultural change,But we now are all painfully aware of the drawbacks of 20th century C&C.,1,"software, part, astronomical, engineering, integral, quality, come, projects"
A1,RQ1,Main Guidelines,Simplify and improve usability,C&C technology must match human abilities of both the operators and the end users.,0,"systems, data, security, system, privacy, users, development, computing"
A1,RQ1,Main Guidelines,Ensure security and privacy,We must protect the security and privacy of C&C users from criminals and terrorists.,0,"systems, data, security, system, privacy, users, development, computing"
A1,RQ1,Main Guidelines,Adapt and evolve,another bold challenge is how to advance the SPUR manifesto.,4,"process, mining, data, business, provides, bridge, modeling, important"
A1,RQ1,Impact and Applicability,Promote collaboration and communication,Consider this a call to arms for tackling that challenge.,3,"design, principles, community, people, need, thinking, must, patterns"
A1,RQ1,Call to Action,Challenge the status quo,Consider this a call to arms for tackling that challenge.,3,"design, principles, community, people, need, thinking, must, patterns"
A1,RQ1,Call to Action,Creating a better future,If we instead rise to these challenges to address weaknesses while leveraging new opportunities [...] then I believe the legacy of 21st century C&C will be one that we can be proud of.,2,"research, open, work, future, extent, basic, also, community"
A1,RQ3,Relationship with SWeBok,Software architecture,Massively Parallel Microprocessors [...] another bold challenge is how to advance the SPUR manifesto when the hardware building block is a computer rather than a transistor.,3,"design, principles, community, people, need, thinking, must, patterns"
A1,RQ3,Relationship with SWeBok,Software Quality,Reliability: We need to create C&C the world can depend upon.,3,"design, principles, community, people, need, thinking, must, patterns"
A1,RQ3,Relationship with SWeBok,Software Security,Security/Privacy: We must protect the security and privacy of C&C users from criminals and terrorists.,0,"systems, data, security, system, privacy, users, development, computing"
A2,RQ1,Main Guidelines,Adopt new technologies and approaches,We need to privilege the sensing and sensible human ‘interpreter’ over the sensing and ‘once-and-for-all-interpreted’ system.,0,"systems, data, security, system, privacy, users, development, computing"
A2,RQ1,Main Guidelines,Develop tools and techniques,Creative practices in the arts can fruitfully drive practical and conceptual attempts to address the Performative Development of such applications.,0,"systems, data, security, system, privacy, users, development, computing"
A2,RQ1,Main Guidelines,Conduct research and experiments,These attempts have a strong explorative component and focus on the social aspects of the creative achievement.,0,"systems, data, security, system, privacy, users, development, computing"
A2,RQ1,Main Guidelines,Simplify and improve usability,In these cases the director is looking for ways of making the mediating artefacts in order for the performance to become more transparent to actors’ inner traits and personality.,0,"systems, data, security, system, privacy, users, development, computing"
A2,RQ1,Impact and Applicability,Promote collaboration and communication,The central point that emerged from the observations is that the mobile multimedia records emerged collaboratively and that the relevance of the media collections of a member resided in the way they were combined with the ones of the other members.,2,"research, open, work, future, extent, basic, also, community"
A2,RQ1,Call to Action,Creating a better future,Our agenda heavily relies on the generative roles of such principles from media studies. The perspective in which we frame and apply them is that of authorship and participation as a form of skilled appropriation.,3,"design, principles, community, people, need, thinking, must, patterns"
A2,RQ3,Relationship with SWeBok,Software Design,The object of our design interventions is to engage people in creative activities in which a major contribution in their imaginative work is to create new human relationships while they tackle with the urge of socially determine their presence in a newly created space.,3,"design, principles, community, people, need, thinking, must, patterns"
A2,RQ3,Relationship with SWeBok,Software Engineering Professional Practice,The practical wisdom in the performing arts can be applied by devising activities with interactive technology.,3,"design, principles, community, people, need, thinking, must, patterns"
A3,RQ1,Principles and Values,Innovation,Technological advances provide an increasing opportunity for service computing.,0,"systems, data, security, system, privacy, users, development, computing"
A3,RQ1,Objective and Motivation,Responding to emerging challenges and opportunities,We propose a manifesto—a community declaration of objectives and approaches—as a way to establish common ground among researchers in the field and to guide its future development.,2,"research, open, work, future, extent, basic, also, community"
A3,RQ1,Objective and Motivation,Solve existing problems and challenges,It identifies the major obstacles that hinder the development and potential realization of service computing in the real world.,0,"systems, data, security, system, privacy, users, development, computing"
A3,RQ1,Main Guidelines,Conduct research and experiments,A number of journals and conferences were founded to assist research development in this area.,2,"research, open, work, future, extent, basic, also, community"
A3,RQ1,Main Guidelines,Promote collaboration and communication,An important direction is to formalize sociotechnical interactions as a basis for governance of autonomous services.,4,"process, mining, data, business, provides, bridge, modeling, important"
A3,RQ1,Impact and Applicability,Consider context and application,Selecting and composing services from numerous and ever-changing devices and services to fulfill user requirements in a real-time and context-aware fashion is a difficult mission.,0,"systems, data, security, system, privacy, users, development, computing"
A3,RQ2,Gaps,Lack of practical guidelines for implementing principles,Service systems have so far been built without an adequate rigorous foundation that would enable reasoning about them.,0,"systems, data, security, system, privacy, users, development, computing"
A4,RQ1,Principles and Values,Artificial intelligence,ABPMS is a new generation of business process management systems empowered by trustworthy AI technology to reason and act upon data within a set of restrictions.,4,"process, mining, data, business, provides, bridge, modeling, important"
A4,RQ1,Main Guidelines,Adapt and evolve,An ABPMS must therefore be able to adapt itself to the new process context in real time.,4,"process, mining, data, business, provides, bridge, modeling, important"
A4,RQ1,Impact and Applicability,Develop tools and techniques,ABPMS should be able to achieve more complex automation than a traditional BPMS by using AI to minimize human-dependent training.,4,"process, mining, data, business, provides, bridge, modeling, important"
A5,RQ3,Relationship with SWeBok,Software architecture,Atomic actions...allow a wide range of faults to be tolerated by using backward and forward recovery. These actions provide mechanisms that align with architectural concerns for resilience and fault tolerance.,2,"research, open, work, future, extent, basic, also, community"
A5,RQ3,Relationship with SWeBok,Software Quality,The dependability of a computing system is its ability to deliver service that can justifiably be trusted.,0,"systems, data, security, system, privacy, users, development, computing"
A6,RQ1,Principles and Values,Openness,Keep it open! We believe there is an inherent value in openness.,2,"research, open, work, future, extent, basic, also, community"
A6,RQ1,Principles and Values,Ethics and Responsibility,Responsible technology needs to work tomorrow as well as today.,3,"design, principles, community, people, need, thinking, must, patterns"
A6,RQ1,Main Guidelines,Ensure security and privacy,Arduino believes you should have control of your own cloud service and control who access your data always.,0,"systems, data, security, system, privacy, users, development, computing"
A6,RQ1,Impact and Applicability,Seek sustainability,Sustainable – against disposable design of fast moving consumer electronic goods.,3,"design, principles, community, people, need, thinking, must, patterns"
A6,RQ2,Gaps,Lack of practical guidelines for implementing principles,Doteveryone’s take on understandability pushes heavily for clarity about how a product or service works.,3,"design, principles, community, people, need, thinking, must, patterns"
A4,RQ3,Relationship with SWeBok,Software Engineering Models and Methods,CMMN provides the possibility for ad hoc sequencing that emerges by the case. Another alternative to CMMN could be to rely on the belief-desire-intention (BDI) agent perspective.?,4,"process, mining, data, business, provides, bridge, modeling, important"
A7,RQ1,Principles and Values,Process improvement,The CbyC approach has two primary goals – to deliver software with defect rates an order of magnitude lower than current best commercial practice in a cost-effective manner; and to deliver durable software that is resilient to change throughout its lifecycle.,1,"software, part, astronomical, engineering, integral, quality, come, projects"
A7,RQ1,Objective and Motivation,Responding to emerging challenges and opportunities,High integrity software systems are often so large that conventional development processes cannot get anywhere near achieving tolerable defect rates.,1,"software, part, astronomical, engineering, integral, quality, come, projects"
A7,RQ3,Relationship with SWeBok,Software Engineering Process,The key to implementing these principles is to introduce sufficient precision at each step of the development of the software to enable reasoning about the correctness of that step.,1,"software, part, astronomical, engineering, integral, quality, come, projects"
A8,RQ1,Principles and Values,User focus,The creation of accessible and inclusive technologies must start by understanding the actual user needs and what new technology opportunities there are.,3,"design, principles, community, people, need, thinking, must, patterns"
A8,RQ1,Principles and Values,Openness,A bottom-up approach to innovation is sparking a generation of people to design their own solutions and to share these to allow others to further evolve their designs.,3,"design, principles, community, people, need, thinking, must, patterns"
A8,RQ1,Objective and Motivation,Changing culture and practices,The time is ripe for HCI to lead the way in making the world truly accessible and inclusive.,2,"research, open, work, future, extent, basic, also, community"
A8,RQ1,Main Guidelines,Adopt new technologies and approaches,DIX will utilize Dan Saffer’s four types of interaction design practice [...] to co-create completely new ways of interacting with technology.,3,"design, principles, community, people, need, thinking, must, patterns"
A8,RQ1,Main Guidelines,Consider context and application,DIX will utilize Dan Saffer’s four types of interaction design practice [...] to co-create completely new ways of interacting with technology.,3,"design, principles, community, people, need, thinking, must, patterns"
A8,RQ1,Main Guidelines,Share knowledge,We will create an open source community of researchers and innovators to co-develop research and design protocols with disabled people.,2,"research, open, work, future, extent, basic, also, community"
A8,RQ1,Call to Action,Collaborate and share,We will create an open source community of researchers and innovators to co-develop research and design protocols with disabled people.,2,"research, open, work, future, extent, basic, also, community"
A8,RQ1,Call to Action,Educate and train,We plan to create a global community of people who can contribute to the development of the curriculum for DIX.,3,"design, principles, community, people, need, thinking, must, patterns"
A8,RQ1,Call to Action,Building and strengthening communities,We plan to create a global community of people who can contribute to the development of the curriculum for DIX.,3,"design, principles, community, people, need, thinking, must, patterns"
A9,RQ1,Principles and Values,Collaboration,Sharing creations and talking about them with other people is a key characteristic of DiY culture.,3,"design, principles, community, people, need, thinking, must, patterns"
A9,RQ1,Objective and Motivation,Transforming current practices through innovations,The manifesto aims at providing a framework for do-it-yourself systems enabling non-technical users to create internet-of-things applications.,0,"systems, data, security, system, privacy, users, development, computing"
A9,RQ1,Main Guidelines,Conduct research and experiments,Qualitative research was conducted to understand how and why users would create their own smart experiences in an Internet-of-things world.,2,"research, open, work, future, extent, basic, also, community"
A9,RQ1,Call to Action,Collaborate and share,Sharing creations and talking about them with other people is a key characteristic of DiY culture.,3,"design, principles, community, people, need, thinking, must, patterns"
A9,RQ2,Gaps,Lack of integration between different areas of software engineering,There is still a substantial amount of work to be done in order to allow non-technical users to write a program without requiring any programming skills.,2,"research, open, work, future, extent, basic, also, community"
A9,RQ3,Relationship with SWeBok,Software Construction,The smallest entity in the system is called a ‘useful component’ (e.g. a hardware light sensor that can transmit values to a system).,0,"systems, data, security, system, privacy, users, development, computing"
A9,RQ3,Relationship with SWeBok,Software Engineering Models and Methods,High-level abstraction models are presented as 'easy' programming methods.,3,"design, principles, community, people, need, thinking, must, patterns"
A9,RQ3,Relationship with SWeBok,Computing Foundations,The system should support a spectrum of expertise in computational thinking by offering different layers of computational abstractions.,0,"systems, data, security, system, privacy, users, development, computing"
A10,RQ1,Main Guidelines,Establish standards and guidelines,We issue a call to the community to clearly identify the nature and extent of unsoundness in static analyses.,2,"research, open, work, future, extent, basic, also, community"
A10,RQ1,Main Guidelines,Adapt and evolve,Soundy analysis aims to be as sound as possible without excessively compromising precision and scalability.,4,"process, mining, data, business, provides, bridge, modeling, important"
A10,RQ1,Call to Action,Challenge the status quo,We strongly feel the community should embrace the practical necessity of unsoundness and rethink soundness expectations.,3,"design, principles, community, people, need, thinking, must, patterns"
A10,RQ1,Call to Action,Adopt practices and principles,The programming language research community should adopt the notion of soundiness as a guiding principle.,2,"research, open, work, future, extent, basic, also, community"
A11,RQ1,Principles and Values,User focus,Meta-design shifts control from designers to users and empowers users to create and contribute their own visions and objectives.,0,"systems, data, security, system, privacy, users, development, computing"
A11,RQ1,Principles and Values,Architecture,Meta-design provides a pathway to transform development as coding—a discrete computing activity—into design of artifacts as part of the users’ work (or leisure) practice.,3,"design, principles, community, people, need, thinking, must, patterns"
A11,RQ1,Objective and Motivation,Responding to emerging challenges and opportunities,The future success of EUD depends on creating tools that end users are motivated to learn and use in daily work practices.,2,"research, open, work, future, extent, basic, also, community"
A11,RQ1,Objective and Motivation,Emphasis on collaboration and interdisciplinarity,Meta-design creates interactive systems that define the conditions for interaction... interaction as the real object of creative production.,0,"systems, data, security, system, privacy, users, development, computing"
A11,RQ1,Main Guidelines,Develop tools and techniques,The goal for EUD tools is to reduce the learning burden while providing powerful facilities to address a wide range of problems.,2,"research, open, work, future, extent, basic, also, community"
A11,RQ1,Call to Action,Adopt practices and principles,Meta-design has the potential to create a culture in which all participants in collaborative design processes can express themselves and engage in personally meaningful activities.,3,"design, principles, community, people, need, thinking, must, patterns"
A11,RQ3,Relationship with SWeBok,Software architecture,Meta-design provides a pathway to transform development as coding—a discrete computing activity—into design of artifacts as part of the users’ work practice. (Pertains to the architecture definition and evaluation process.),4,"process, mining, data, business, provides, bridge, modeling, important"
A11,RQ3,Relationship with SWeBok,Software Design, programming is only part of an end-user developer’s needs. (Relates to software design principles and methods.),3,"design, principles, community, people, need, thinking, must, patterns"
A12,RQ1,Principles and Values,Collaboration,Information systems engineering and security engineering research communities traditionally work independently... it is important to unify the efforts on the two fields.,2,"research, open, work, future, extent, basic, also, community"
A12,RQ1,Main Guidelines,Establish standards and guidelines,Security should be considered from the early stages of the development process and security requirements should be defined alongside with the system’s requirements specification.,0,"systems, data, security, system, privacy, users, development, computing"
A12,RQ1,Main Guidelines,Promote collaboration and communication,It is important to unify the efforts on the two fields... to produce solutions that truly work.,2,"research, open, work, future, extent, basic, also, community"
A12,RQ1,Main Guidelines,Share knowledge,It is of paramount importance to produce tools to support the development process... validate the security functionalities of the proposed solution against the security requirements of the system.,4,"process, mining, data, business, provides, bridge, modeling, important"
A12,RQ1,Call to Action,Collaborate and share,There is also need to encourage a curriculum which incorporates the different aspects coming from the various interdisciplinary subjects in order to provide the required knowledge.,2,"research, open, work, future, extent, basic, also, community"
A12,RQ2,Gaps,Lack of practical guidelines for implementing principles,These approaches lack the definition of a structured process for considering security. A well-defined and structured process is of paramount importance when considering security during the development.,4,"process, mining, data, business, provides, bridge, modeling, important"
A12,RQ2,Gaps,Lack of integration between different areas of software engineering,Information systems engineering and security engineering research communities traditionally work independently...This separation not only creates a void in the proposed solutions but it also results in restricted sharing of existing knowledge.,2,"research, open, work, future, extent, basic, also, community"
A12,RQ2,Gaps,Lack of assessment or monitoring of the quality of architecture,One of the main problems of considering security during the development stages of an information system is the lack of methods and techniques to trace the provided functionality to security requirements and also test the solution before the implementation of the system.,0,"systems, data, security, system, privacy, users, development, computing"
A12,RQ3,Relationship with SWeBok,Software architecture,Securing information systems raises a set of intertwined issues in the areas of security engineering and information systems engineering... security mechanisms are enforced into the system without considering the overall design and this usually results in problematic systems and security vulnerabilities.,0,"systems, data, security, system, privacy, users, development, computing"
A13,RQ1,Principles and Values,Collaboration,This article presents a cross-disciplinary initiative to create a common ground and a point of reference for the global community of research and practice in software and sustainability.,2,"research, open, work, future, extent, basic, also, community"
A13,RQ1,Principles and Values,Openness,The Karlskrona Manifesto is a vehicle for a much-needed conversation about sustainability within and beyond the software community.,1,"software, part, astronomical, engineering, integral, quality, come, projects"
A13,RQ1,Objective and Motivation,Criticism of the current situation and the need for cultural change,The lack of long-term thinking in software engineering research and practice has been critiqued throughout the history of the discipline.,1,"software, part, astronomical, engineering, integral, quality, come, projects"
A13,RQ1,Main Guidelines,Address ethical and social issues,The codes of ethics for software professionals must be revisited to account for second and third-order effects of software systems.,1,"software, part, astronomical, engineering, integral, quality, come, projects"
A13,RQ1,Main Guidelines,Seek sustainability,Sustainability is fundamental to our society. The current state of our world is unsustainable in more ways than we often recognize.,2,"research, open, work, future, extent, basic, also, community"
A13,RQ1,Impact and Applicability,Ensure security and privacy,The lack of long-term thinking over security considerations in SE has led to a ‘digital dark age’ where information assets become unreadable due to rapid technology changes.,0,"systems, data, security, system, privacy, users, development, computing"
A13,RQ3,Relationship with SWeBok,Software Quality,Technical sustainability of a software system cannot be separated from social and financial sustainability of the organization that created it.,1,"software, part, astronomical, engineering, integral, quality, come, projects"
A14,RQ1,Principles and Values,User focus,Users before algorithms: Mining algorithms are only useful in industry if users fund their use in real-world applications.,4,"process, mining, data, business, provides, bridge, modeling, important"
A14,RQ1,Principles and Values,Collaboration,Our experience tells us that successful inductive software engineering projects require extensive user input.,1,"software, part, astronomical, engineering, integral, quality, come, projects"
A14,RQ1,Principles and Values,Innovation,We made the case above that successful inductive software engineering projects require extensive user input. User input is not a primary concern of Figure 2.,1,"software, part, astronomical, engineering, integral, quality, come, projects"
A14,RQ1,Principles and Values,Openness,Be open-minded: It is unwise to enter into an inductive study with fixed hypotheses or approaches particularly for data that has not been mined before.,0,"systems, data, security, system, privacy, users, development, computing"
A14,RQ1,Principles and Values,Ethics and Responsibility,Do smart learning: Important outcomes are riding on your conclusions. Make sure that you check and validate them.,4,"process, mining, data, business, provides, bridge, modeling, important"
A14,RQ1,Objective and Motivation,Transforming current practices through innovations,We present both the principles of our manifesto as well as tips (generalizations drawn from commonalities among our individual experience) to aid those who choose to follow these principles.,3,"design, principles, community, people, need, thinking, must, patterns"
A14,RQ1,Objective and Motivation,Solve existing problems and challenges,Understanding user goals to inductively generate the models that most matter to the user.,3,"design, principles, community, people, need, thinking, must, patterns"
A14,RQ1,Impact and Applicability,Ensure security and privacy,Live with the data you have: You go mining with the data you have—not the data you might want or wish to have at a later time.,4,"process, mining, data, business, provides, bridge, modeling, important"
